335,steadily,着実に,Sales increased steadily.,売上は着実に増加した。,
335,steady,安定した、着実な,She made steady progress.,彼女は着実に進歩した。,
338,arise,生じる、起こる,Problems often arise unexpectedly.,問題はしばしば突然発生する。,
338,commute,通勤する,He commutes by train.,彼は電車で通勤している。,
338,commuter,通勤者,Many commuters use this station.,多くの通勤者がこの駅を使う。,
338,embark,乗り出す、着手する,They embarked on a new project.,彼らは新しい計画に着手した。,
338,journey,旅、旅行,We began our journey early.,私たちは早朝に旅を始めた。,
338,luggage,荷物,Where is my luggage?,私の荷物はどこですか。,
338,navigate,航行する、進路を決める,We used a map to navigate.,私たちは地図を使って進んだ。,
338,return,戻る、返す,Please return the book tomorrow.,明日その本を返してください。,
338,rise,上がる、上昇する,Prices continue to rise.,価格は上がり続けている。,【対義語】fall（下がる）
338,sail,航海する、帆,They sailed across the sea.,彼らは海を渡って航海した。,
339,compel,強いる,The law compels companies to act.,その法律は企業に行動を強いる。,
339,dawn,夜明け,We left at dawn.,私たちは夜明けに出発した。,【対義語】dusk（夕暮れ）
339,duty,義務、任務,It is my duty to help.,助けることは私の義務だ。,
339,habitat,生息地,Forests are habitats for many animals.,森林は多くの動物の生息地だ。,
339,immigrant,移民,Many immigrants live in the city.,多くの移民がその都市に住んでいる。,
339,immigration,移民、出入国管理,Immigration changed the country.,移民はその国を変えた。,
339,inhabit,住む、生息する,Many animals inhabit the forest.,多くの動物がその森に生息している。,
339,inhabitant,住民、生息動物,The island has few inhabitants.,その島には住民がほとんどいない。,
339,migrant,移住者、渡り鳥,Many migrants moved to the city.,多くの移住者が都市へ移った。,
339,migrate,移住する、渡る,Birds migrate in winter.,鳥は冬に渡る。,
339,migration,移住、移動,Animal migration is seasonal.,動物の移動は季節的だ。,
339,obligation,義務,We have an obligation to help.,私たちには助ける義務がある。,
339,oblige,義務づける、親切にする,The law obliges drivers to stop.,法律は運転者に停止を義務づけている。,
339,soar,急上昇する、舞い上がる,Prices began to soar.,価格が急上昇し始めた。,
340,arrive,到着する,We arrived at the station.,私たちは駅に到着した。,【対義語】depart（出発する）
340,breathe,呼吸する,Breathe slowly and deeply.,ゆっくり深く呼吸しなさい。,
340,bubble,泡,Bubbles rose in the water.,泡が水中に上がった。,
340,compulsory,義務的な,Education is compulsory.,教育は義務である。,【対義語】optional（任意の）
340,cross,横切る、交差する,Be careful when you cross the street.,道を渡るときは注意しなさい。,
340,damp,湿った,The clothes are still damp.,服はまだ湿っている。,【対義語】dry（乾いた）
340,evaporate,蒸発する,Water evaporates in the sun.,水は太陽の下で蒸発する。,
340,moisture,湿気、水分,The soil needs moisture.,土には水分が必要だ。,
340,sigh,ため息をつく,She sighed with relief.,彼女は安心してため息をついた。,
340,steam,蒸気,Steam rose from the pot.,鍋から蒸気が上がった。,
340,vapor,蒸気、気体,Water vapor rose from the pot.,鍋から水蒸気が上がった。,
341,arrival,到着,Our arrival was delayed.,私たちの到着は遅れた。,
341,destination,目的地,Our destination is Kyoto.,私たちの目的地は京都だ。,
341,disposal,処分、廃棄,Waste disposal is a serious issue.,廃棄物処理は深刻な問題だ。,
341,dispose,処分する、配置する,Please dispose of the trash properly.,ごみを適切に処分してください。,
341,lay,置く、横たえる,Lay the book on the desk.,本を机の上に置きなさい。,
341,layer,層、重なり,The cake has three layers.,そのケーキには3つの層がある。,
341,layout,配置、レイアウト,The layout of the room is simple.,その部屋の配置は単純だ。,
341,situate,位置づける、置く,The town is situated near the river.,その町は川の近くに位置している。,
344,export,輸出する、輸出,Japan exports cars.,日本は自動車を輸出している。,【対義語】import（輸入する）
344,immediate,即座の、直接の,We need immediate action.,私たちは即座の行動が必要だ。,
344,import,輸入する、輸入,Japan imports oil.,日本は石油を輸入している。,【対義語】export（輸出する）
344,instant,即座の、瞬間,I need an instant answer.,即座の答えが必要だ。,
344,instantly,即座に,The machine stopped instantly.,機械は即座に止まった。,
344,scent,香り、におい,The flower has a sweet scent.,その花は甘い香りがする。,
344,shortly,まもなく、簡潔に,She will arrive shortly.,彼女はまもなく到着する。,
344,smell,におい、におう,This flower smells sweet.,この花は甘い香りがする。,
344,sniff,においをかぐ,The dog sniffed the bag.,犬はバッグのにおいをかいだ。,
344,transport,輸送する、交通機関,Trucks transport goods.,トラックは商品を輸送する。,
345,aboard,～に乗って,All passengers are aboard.,乗客は全員乗っている。,
345,automobile,自動車,The automobile industry is changing.,自動車産業は変化している。,
345,enzyme,酵素,Enzymes help digestion.,酵素は消化を助ける。,
345,ferment,発酵する,Grapes ferment into wine.,ブドウは発酵してワインになる。,
345,miniature,小型の、ミニチュアの,She collected miniature cars.,彼女はミニカーを集めていた。,
345,minimal,最小限の,The damage was minimal.,被害は最小限だった。,【対義語】maximum（最大限）
345,minimize,最小化する,We must minimize the risk.,私たちはリスクを最小化しなければならない。,【対義語】maximize（最大化する）
345,minimum,最小限、最低限,The minimum age is eighteen.,最低年齢は18歳だ。,【対義語】maximum（最大限）
345,molecular,分子の,Molecular biology is difficult.,分子生物学は難しい。,
345,molecule,分子,Water is made of molecules.,水は分子でできている。,
345,niche,ニッチ、適所,The company found a niche market.,その会社はニッチ市場を見つけた。,
345,particle,粒子,A particle is very small.,粒子は非常に小さい。,
345,tiny,とても小さい,They lived in a tiny house.,彼らはとても小さな家に住んでいた。,【対義語】huge（巨大な）
345,vehicle,乗り物、車両,This vehicle uses electricity.,この乗り物は電気を使う。,
346,amusement,娯楽、楽しみ,The park provides amusement for children.,その公園は子供たちに娯楽を提供する。,
346,county,郡,The county has many farms.,その郡には多くの農場がある。,
346,district,地区、地域,He lives in a quiet district.,彼は静かな地区に住んでいる。,
346,memorable,記憶に残る,It was a memorable trip.,それは記憶に残る旅行だった。,
346,memorization,暗記、記憶,Memorization takes time.,暗記には時間がかかる。,
346,memory,記憶、思い出,I have a clear memory of that day.,私はその日のことをはっきり覚えている。,
346,province,州、省、地方,He lives in a northern province.,彼は北部の州に住んでいる。,
346,recreate,再現する、作り直す,They recreated the old town.,彼らは古い町を再現した。,
346,recreation,娯楽、休養,Swimming is good recreation.,水泳はよい娯楽だ。,
346,refresh,さわやかにする、更新する,A short rest refreshed me.,短い休憩で私は元気を取り戻した。,
346,region,地域,This region is famous for fruit.,この地域は果物で有名だ。,
346,regional,地域の、地方の,Regional differences are important.,地域差は重要だ。,
346,resume,再開する,Classes will resume tomorrow.,授業は明日再開する。,
346,revival,復活、再生,The festival saw a revival.,その祭りは復活した。,
346,revive,復活させる、よみがえる,They revived the old tradition.,彼らは古い伝統を復活させた。,
346,ward,病棟、区,She works in a children's ward.,彼女は小児病棟で働いている。,
347,drift,漂う,The boat drifted away.,ボートは漂って離れていった。,
347,float,浮く,Wood floats on water.,木は水に浮く。,【対義語】sink（沈む）
347,nonsense,無意味なこと、ばかげたこと,What he said was nonsense.,彼が言ったことはばかげていた。,
347,sense,感覚、意味,This word has several senses.,この単語にはいくつかの意味がある。,
347,sensible,分別のある、賢明な,That is a sensible choice.,それは賢明な選択だ。,
347,swing,揺れる、振る,The door swung open.,ドアが揺れて開いた。,
347,telegraph,電信、電報,The telegraph changed communication.,電信は通信を変えた。,
347,wire,針金、電線,The wire was cut.,電線が切れていた。,
350,administer,管理する、投与する,The nurse administered the medicine.,看護師が薬を投与した。,
350,administration,管理、行政,The administration announced a new policy.,行政は新政策を発表した。,
350,administrative,管理上の,She handles administrative work.,彼女は事務業務を担当している。,
350,administrator,管理者,Contact the system administrator.,システム管理者に連絡してください。,
350,chairman,議長、会長,The chairman opened the meeting.,議長が会議を開始した。,
350,confront,直面する、立ち向かう,We must confront the problem.,私たちはその問題に立ち向かわなければならない。,
350,confrontation,対立、直面,The confrontation became serious.,その対立は深刻になった。,
350,direct,直接の、指示する,This is a direct answer.,これは直接的な答えだ。,【対義語】indirect（間接的な）
350,forum,公開討論会、フォーラム,We joined an online forum.,私たちはオンラインフォーラムに参加した。,
350,intimacy,親密さ,Their intimacy grew over time.,彼らの親密さは時間とともに増した。,
350,intimate,親密な,They are intimate friends.,彼らは親密な友人だ。,
350,oppose,反対する,They opposed the plan.,彼らはその計画に反対した。,【対義語】support（支持する）
350,panel,委員会、パネル,The panel discussed the issue.,委員会はその問題を議論した。,
350,supervise,監督する、管理する,She supervises the team.,彼女はチームを監督している。,
350,supervision,監督、管理,The work was done under supervision.,その仕事は監督の下で行われた。,
351,conspiracy,陰謀,They discovered a conspiracy.,彼らは陰謀を発見した。,
351,counter,反対する、売り場,He countered the argument.,彼はその主張に反論した。,
351,familiar,よく知っている、なじみのある,This name is familiar to me.,この名前は私になじみがある。,【対義語】unfamiliar（なじみのない）
351,familiarity,親しみ、精通,Familiarity with the topic helps.,その話題に精通していることは役に立つ。,
351,rebel,反逆者、反抗する,The rebels fought against the king.,反逆者たちは王に対して戦った。,
351,rebellion,反乱,The rebellion lasted for years.,その反乱は何年も続いた。,
351,reverse,逆にする、反対の,Reverse the order of the numbers.,数字の順序を逆にしなさい。,
351,revolt,反乱、反抗する,The people revolted against the king.,人々は王に反乱を起こした。,
351,tear,涙、引き裂く,Tears filled her eyes.,彼女の目に涙が浮かんだ。,
351,unfamiliar,なじみのない、よく知らない,This word is unfamiliar to me.,この単語は私にはなじみがない。,【対義語】familiar（なじみのある）
351,vivid,鮮やかな、生き生きとした,I have a vivid memory of that day.,私はその日の鮮明な記憶がある。,
351,vividly,鮮やかに、生き生きと,She described the scene vividly.,彼女はその場面を生き生きと描写した。,
352,hemisphere,半球,Japan is in the Northern Hemisphere.,日本は北半球にある。,
352,monument,記念碑,We visited a war monument.,私たちは戦争記念碑を訪れた。,
352,recall,思い出す、呼び戻す,I cannot recall his name.,私は彼の名前を思い出せない。,
352,recollection,記憶、思い出,I have no recollection of the event.,私はその出来事の記憶がない。,
352,remember,覚えている、思い出す,Do you remember his name?,彼の名前を覚えていますか。,【対義語】forget（忘れる）
352,scope,範囲,The scope of the study is broad.,その研究の範囲は広い。,
352,sight,視力、光景,The mountain was a beautiful sight.,その山は美しい光景だった。,
352,special,特別な,This is a special day.,今日は特別な日だ。,【対義語】ordinary（普通の）
352,specialist,専門家,She is a cancer specialist.,彼女はがんの専門家だ。,
352,specialization,専門化、専門分野,His specialization is biology.,彼の専門分野は生物学だ。,
352,specialize,専門にする,He specializes in history.,彼は歴史を専門にしている。,
352,specially,特別に,This cake was specially made for you.,このケーキはあなたのために特別に作られた。,
352,spend,費やす、使う,I spend two hours studying.,私は勉強に2時間費やす。,
353,brief,短い、簡潔な,Please give a brief answer.,簡潔に答えてください。,【対義語】lengthy（長い）
353,briefly,簡潔に,He explained the plan briefly.,彼はその計画を簡潔に説明した。,
353,moment,瞬間、時,"Wait a moment, please.",少し待ってください。,
353,momentum,勢い、運動量,The team gained momentum.,チームは勢いを増した。,
353,remind,思い出させる,Please remind me tomorrow.,明日私に思い出させてください。,
353,reminder,思い出させるもの、通知,I set a reminder on my phone.,私は携帯にリマインダーを設定した。,
353,souvenir,土産,I bought a souvenir in Kyoto.,京都で土産を買った。,
353,temporarily,一時的に,The store is temporarily closed.,その店は一時的に閉まっている。,
353,temporary,一時的な,This is a temporary solution.,これは一時的な解決策だ。,【対義語】permanent（永久の）
353,token,しるし、象徴、トークン,This gift is a token of thanks.,この贈り物は感謝のしるしです。,
353,unlikely,ありそうにない,It is unlikely to rain.,雨は降りそうにない。,【対義語】likely（ありそうな）
356,countryside,田舎、地方,They live in the countryside.,彼らは田舎に住んでいる。,
356,genuine,本物の、誠実な,This is genuine leather.,これは本物の革だ。,【対義語】fake（偽物の）
356,landscape,風景、景観,The landscape was beautiful.,その風景は美しかった。,
356,photograph,写真、写真を撮る,He took a photograph of the mountain.,彼は山の写真を撮った。,
356,photography,写真撮影、写真術,Photography is his hobby.,写真撮影は彼の趣味だ。,
356,privacy,プライバシー,We must respect privacy.,私たちはプライバシーを尊重しなければならない。,
356,private,私的な、個人の,This is a private matter.,これは個人的な問題だ。,【対義語】public（公の）
356,public,公の、一般の,This is a public park.,これは公共の公園だ。,【対義語】private（私的な）
356,publicity,宣伝、注目,The event received much publicity.,そのイベントは多くの注目を集めた。,
356,publicly,公に、公式に,He apologized publicly.,彼は公に謝罪した。,
356,scene,場面、景色,This is my favorite scene.,これは私の好きな場面だ。,
356,scenery,風景,The scenery was beautiful.,風景は美しかった。,
356,supernatural,超自然の,The story is about supernatural powers.,その物語は超自然の力についてだ。,
357,authentic,本物の、真正の,This restaurant serves authentic Italian food.,この店は本格的なイタリア料理を出す。,【対義語】fake（偽物の）
357,authenticity,真正性,The authenticity of the painting was confirmed.,その絵画の真正性が確認された。,
357,duplicate,複製する、重複した,Please duplicate this file.,このファイルを複製してください。,
357,era,時代,We live in the digital era.,私たちはデジタル時代に生きている。,
357,fancy,高級な、空想する,They stayed at a fancy hotel.,彼らは高級ホテルに泊まった。,
357,forge,築く、偽造する,They forged a strong relationship.,彼らは強い関係を築いた。,
357,imaginary,想像上の,The child had an imaginary friend.,その子供には想像上の友達がいた。,【対義語】real（現実の）
357,imagination,想像力,Children have rich imagination.,子供たちは豊かな想像力を持っている。,
357,modern,現代の、近代的な,Modern technology changes quickly.,現代技術は急速に変化する。,【対義語】ancient（古代の）
357,refine,改良する、精製する,We refined the design.,私たちはデザインを改良した。,
357,sophisticated,洗練された、高度な,This is a sophisticated system.,これは高度なシステムだ。,
357,sophistication,洗練、高度さ,The design shows sophistication.,そのデザインには洗練が感じられる。,
358,attribute,属性、～のせいだとする,Hard work is an important attribute.,努力は重要な資質だ。,
358,conspicuous,目立つ、顕著な,His red hat was conspicuous.,彼の赤い帽子は目立っていた。,
358,feature,特徴、特集,This phone has a useful feature.,この電話には便利な機能がある。,
358,grand,壮大な、豪華な,The hotel was grand.,そのホテルは豪華だった。,
358,mood,気分、雰囲気,She was in a good mood.,彼女は機嫌がよかった。,
358,outstanding,際立った、優れた,She made an outstanding achievement.,彼女は優れた業績を上げた。,
358,poet,詩人,The poet wrote about nature.,その詩人は自然について書いた。,
358,poetry,詩、詩歌,She enjoys reading poetry.,彼女は詩を読むのが好きだ。,
358,prominence,目立つこと、重要性,She gained prominence as a writer.,彼女は作家として名声を得た。,
358,prominent,目立つ、著名な,He is a prominent scientist.,彼は著名な科学者だ。,
358,trait,特徴、特性,Kindness is a good trait.,親切さは良い特性だ。,
359,beauty,美、美しさ,We admired the beauty of nature.,私たちは自然の美しさに感動した。,
359,colonial,植民地の,The country has a colonial history.,その国には植民地の歴史がある。,
359,colonize,植民地化する,The island was colonized.,その島は植民地化された。,
359,colony,植民地、群れ,The country was once a colony.,その国はかつて植民地だった。,
359,dominance,優位、支配,The company has market dominance.,その会社は市場で優位に立っている。,
359,dominant,支配的な、優勢な,This is the dominant species.,これは優勢な種である。,
359,dominate,支配する,One team dominated the game.,一つのチームが試合を支配した。,
359,grace,優雅さ、恩恵,She moved with grace.,彼女は優雅に動いた。,
359,lovely,美しい、すてきな,What a lovely day!,なんてすてきな日だろう。,
359,magnificent,壮大な、見事な,The view was magnificent.,その景色は壮大だった。,
359,portrait,肖像画、人物描写,The museum has his portrait.,その美術館には彼の肖像画がある。,
359,portray,描く、表現する,The movie portrays family life.,その映画は家族生活を描いている。,
359,profile,プロフィール、横顔,I updated my profile.,私はプロフィールを更新した。,
362,anonymous,匿名の,An anonymous donor gave money.,匿名の寄付者がお金を寄付した。,
362,confidential,秘密の、機密の,This information is confidential.,この情報は機密です。,
362,gossip,うわさ話,Do not spread gossip.,うわさ話を広めてはいけない。,
362,implication,含意、影響,The implication is clear.,その含意は明らかだ。,
362,implicit,暗黙の、含まれた,There was implicit agreement.,暗黙の合意があった。,【対義語】explicit（明白な）
362,imply,暗に意味する,His words imply agreement.,彼の言葉は同意を暗示している。,
362,modification,修正、変更,The plan needs modification.,その計画には修正が必要だ。,
362,modify,修正する、変更する,We modified the design.,私たちはデザインを修正した。,
362,mutation,突然変異,The mutation changed the gene.,その突然変異は遺伝子を変化させた。,
362,rewrite,書き直す,Please rewrite this sentence.,この文を書き直してください。,
362,rumor,うわさ,I heard a strange rumor.,奇妙なうわさを聞いた。,
362,scandal,スキャンダル、不祥事,The scandal damaged his reputation.,その不祥事は彼の評判を傷つけた。,
362,secretly,密かに,He secretly opened the box.,彼は密かに箱を開けた。,
362,technique,技術、手法,She learned a new technique.,彼女は新しい技術を学んだ。,
363,arrest,逮捕する,The police arrested the suspect.,警察は容疑者を逮捕した。,
363,detective,探偵、刑事,The detective solved the case.,探偵はその事件を解決した。,
363,faith,信頼、信仰,She has faith in him.,彼女は彼を信頼している。,
363,faithful,忠実な、誠実な,He is a faithful friend.,彼は誠実な友人だ。,【対義語】unfaithful（不誠実な）
363,friction,摩擦,There was friction between the two groups.,その二つの集団の間に摩擦があった。,
363,hostage,人質,The criminals took a hostage.,犯人たちは人質を取った。,
363,indication,兆候、指示,There is no indication of danger.,危険の兆候はない。,
363,misunderstand,誤解する,Do not misunderstand my words.,私の言葉を誤解しないでください。,
363,misunderstanding,誤解,There was a misunderstanding between them.,彼らの間に誤解があった。,
363,reliable,信頼できる,This source is reliable.,この情報源は信頼できる。,【対義語】unreliable（信頼できない）
366,educate,教育する,Schools educate children.,学校は子供たちを教育する。,
366,fascinate,魅了する,The story fascinated me.,その物語は私を魅了した。,
366,fascinating,魅力的な、非常に興味深い,It was a fascinating book.,それはとても興味深い本だった。,
366,fascination,魅力、強い関心,She has a fascination with space.,彼女は宇宙に強い関心を持っている。,
366,gather,集める、集まる,People gathered in the park.,人々は公園に集まった。,
366,gathering,集まり,There was a family gathering.,家族の集まりがあった。,
366,reception,受付、歓迎,The reception is on the first floor.,受付は1階にあります。,
366,receptionist,受付係,The receptionist greeted us.,受付係が私たちを迎えた。,
366,ritual,儀式、慣習,The ritual is held every year.,その儀式は毎年行われる。,
366,spiritual,精神の、霊的な,Meditation can be a spiritual practice.,瞑想は精神的な実践になりうる。,
366,tempt,誘惑する,The smell tempted me to eat.,その匂いは私を食べるよう誘惑した。,
366,temptation,誘惑,I resisted the temptation.,私は誘惑に抵抗した。,
367,attempt,試みる、試み,She attempted to solve the problem.,彼女はその問題を解こうとした。,
367,close,閉じる、近い,"Close the door, please.",ドアを閉めてください。,【対義語】open（開ける）
367,contact,接触、連絡する,Please contact me tomorrow.,明日私に連絡してください。,
367,contribute,貢献する、寄付する,Everyone can contribute to the project.,誰でもそのプロジェクトに貢献できる。,
367,contribution,貢献、寄付,His contribution was important.,彼の貢献は重要だった。,
367,convict,有罪判決を下す、囚人,The man was convicted of theft.,その男は窃盗で有罪判決を受けた。,
367,conviction,確信、有罪判決,She spoke with conviction.,彼女は確信を持って話した。,
367,enormous,巨大な、莫大な,The building is enormous.,その建物は巨大だ。,【対義語】tiny（とても小さい）
367,enormously,非常に、莫大に,The plan was enormously expensive.,その計画は非常に高額だった。,
367,penalty,罰、罰金,There is a penalty for late payment.,支払いが遅れると罰金がある。,
367,punish,罰する,The teacher punished the student.,先生はその生徒を罰した。,
367,punishment,罰,Punishment should be fair.,罰は公正であるべきだ。,
367,trial,裁判、試み,The trial lasted three weeks.,その裁判は3週間続いた。,
