20,bind,縛る、結びつける,This rule binds all members.,この規則は全会員を拘束する。,
20,characteristic,特徴、特有の,Patience is his main characteristic.,忍耐強さが彼の主な特徴だ。,
20,cultivate,耕す、育てる,Farmers cultivate rice.,農家は米を栽培する。,
20,cultivation,栽培、耕作,Rice cultivation requires water.,稲作には水が必要だ。,
20,cultural,文化の,Cultural differences are interesting.,文化の違いは興味深い。,
20,culture,文化,Language is part of culture.,言語は文化の一部だ。,
20,historian,歴史家,The historian studied ancient Japan.,その歴史家は古代日本を研究した。,
20,historical,歴史の、歴史的な,This is a historical event.,これは歴史的な出来事だ。,
20,history,歴史,We study Japanese history.,私たちは日本史を学んでいる。,
20,plant,植物、植える,We planted trees in the park.,私たちは公園に木を植えた。,
20,plantation,農園、大規模農場,They worked on a coffee plantation.,彼らはコーヒー農園で働いた。,
20,tie,結ぶ、ネクタイ,Tie your shoes.,靴ひもを結びなさい。,
20,unify,統一する、まとめる,The leader unified the team.,リーダーはチームをまとめた。,
20,unique,独特の、唯一の,She has a unique style.,彼女には独特のスタイルがある。,
20,unite,団結する、結合する,The people united for peace.,人々は平和のために団結した。,【対義語】divide（分ける）
21,account,説明、口座,I opened a bank account.,銀行口座を開設した。,
21,cause,原因、引き起こす,What caused the accident?,何がその事故を引き起こしたのですか。,
21,edible,食べられる,These berries are edible.,これらのベリーは食べられる。,【対義語】inedible（食べられない）
21,fact,事実,This is an important fact.,これは重要な事実だ。,
21,matter,問題、物質,This is an important matter.,これは重要な問題だ。,
21,sphere,球、領域,The earth is like a sphere.,地球は球のような形をしている。,
21,spice,香辛料、スパイス,This curry has many spices.,このカレーには多くの香辛料が入っている。,
21,taste,味、味わう,This soup tastes good.,このスープはおいしい。,
21,tasty,おいしい,This cake is tasty.,このケーキはおいしい。,
21,treat,扱う、治療する,The doctor treated the patient.,医師は患者を治療した。,
21,treatment,治療、扱い,The treatment was effective.,その治療は効果的だった。,
24,birth,誕生,The birth of a child brought joy.,子供の誕生は喜びをもたらした。,
24,female,女性の、雌の,The female bird built a nest.,雌の鳥が巣を作った。,【対義語】male（男性の、雄の）
24,generate,生み出す、発生させる,The machine generates electricity.,その機械は電気を生み出す。,
24,generation,世代,This problem affects the next generation.,この問題は次の世代に影響する。,
24,leave,去る、残す,I will leave home at seven.,私は7時に家を出ます。,
24,maternal,母の、母性的な,She showed maternal care.,彼女は母親らしい世話をした。,
24,meantime,その間,"In the meantime, please wait here.",その間、ここで待っていてください。,
24,pregnancy,妊娠,She took care of her health during pregnancy.,彼女は妊娠中、健康に気をつけた。,
24,pregnant,妊娠している,She is pregnant.,彼女は妊娠している。,
24,raise,上げる、育てる,"Raise your hand, please.",手を上げてください。,【対義語】lower（下げる）
24,while,～する間、一方で,Please wait while I check.,確認する間、待ってください。,
25,guard,守る、警備員,The guard checked the entrance.,警備員が入口を確認した。,
25,hunt,狩る、探す,They hunt animals in the forest.,彼らは森で動物を狩る。,
25,hunter,狩人、猟師,The hunter followed the tracks.,猟師は足跡を追った。,
25,instead,その代わりに,I stayed home instead.,代わりに私は家にいた。,
25,offend,怒らせる、感情を害する,His words offended her.,彼の言葉は彼女を怒らせた。,
25,offense,違反、攻撃、侮辱,He apologized for the offense.,彼はその無礼を謝罪した。,
25,offensive,不快な、攻撃的な,His comment was offensive.,彼の発言は不快だった。,
25,secure,安全な、確保する,We found a secure place.,私たちは安全な場所を見つけた。,【対義語】insecure（不安定な）
25,security,安全、防犯,Security is important at airports.,空港では安全管理が重要だ。,
28,harsh,厳しい、過酷な,The desert has a harsh climate.,砂漠は過酷な気候だ。,【対義語】gentle（穏やかな）
28,health,健康,Health is more important than money.,健康はお金よりも大切だ。,
28,healthcare,医療、健康管理,Healthcare costs are rising.,医療費が上がっている。,
28,healthy,健康な、健康によい,She eats healthy food.,彼女は健康によい食べ物を食べている。,【対義語】unhealthy（不健康な）
28,liver,肝臓,Alcohol can damage the liver.,アルコールは肝臓を傷めることがある。,
28,mammal,哺乳類,A whale is a mammal.,クジラは哺乳類だ。,
28,never,決して～ない,I never forget your kindness.,私はあなたの親切を決して忘れない。,【対義語】always（いつも）
28,produce,生産する、生み出す,The factory produces cars.,その工場は車を生産している。,
28,producer,生産者、製作者,The producer made the film.,その製作者が映画を作った。,
28,product,製品、産物,This product is popular.,この製品は人気がある。,
28,role,役割,Everyone has a role.,誰にでも役割がある。,
28,unhealthy,不健康な,Too much sugar is unhealthy.,砂糖の取りすぎは不健康だ。,【対義語】healthy（健康な）
29,elsewhere,どこか他の場所で,We should look elsewhere.,私たちは他の場所を探すべきだ。,
29,none,誰も～ない、何も～ない,None of them knew the answer.,彼らの誰も答えを知らなかった。,
29,nor,～もまた～ない,"He did not call, nor did he write.",彼は電話も手紙もしなかった。,
29,nowhere,どこにも～ない,I could find it nowhere.,私はそれをどこにも見つけられなかった。,
29,sacrifice,犠牲、犠牲にする,He made a sacrifice for his family.,彼は家族のために犠牲を払った。,
29,struggle,苦闘する、もがく,She struggled with the problem.,彼女はその問題に苦闘した。,
29,suffer,苦しむ、被る,Many people suffered from hunger.,多くの人が飢えに苦しんだ。,
29,suffering,苦しみ、苦痛,The war caused great suffering.,戦争は大きな苦しみをもたらした。,
29,toll,通行料、犠牲者数,We paid a toll on the highway.,私たちは高速道路で通行料を払った。,
29,victim,被害者、犠牲者,The victim was taken to the hospital.,被害者は病院に運ばれた。,
30,ape,類人猿,The ape climbed the tree.,その類人猿は木に登った。,
30,curiosity,好奇心,Children have great curiosity.,子供たちは強い好奇心を持っている。,
30,curious,好奇心の強い、知りたがる,She is curious about space.,彼女は宇宙に興味がある。,
30,curiously,好奇心を持って、不思議そうに,He looked at it curiously.,彼はそれを不思議そうに見た。,
30,human,人間、人間の,Humans need water to live.,人間は生きるために水が必要だ。,
30,humanity,人類、人間性,Humanity faces many challenges.,人類は多くの課題に直面している。,
30,lack,不足、不足している,He lacks experience.,彼は経験が不足している。,
30,mankind,人類,Mankind has changed the environment.,人類は環境を変えてきた。,
30,scarce,不足している、乏しい,Water is scarce in the desert.,砂漠では水が不足している。,【対義語】abundant（豊富な）
30,scarcely,ほとんど～ない,There was scarcely any food left.,食べ物はほとんど残っていなかった。,
30,scarcity,不足、欠乏,The scarcity of water is serious.,水不足は深刻だ。,
30,shortage,不足,There is a shortage of water.,水不足がある。,
31,area,地域、分野,This area is very quiet.,この地域はとても静かだ。,
31,bleed,出血する,His nose began to bleed.,彼の鼻から血が出始めた。,
31,happen,起こる,What happened yesterday?,昨日何が起こったのですか。,
31,happening,出来事,It was a strange happening.,それは奇妙な出来事だった。,
31,plentiful,豊富な,Food was plentiful.,食料は豊富だった。,【対義語】scarce（不足した）
31,plenty,たくさん、十分,We have plenty of time.,私たちには十分な時間がある。,
31,primate,霊長類,Humans are primates.,人間は霊長類である。,
31,reason,理由、理性,What is the reason?,理由は何ですか。,
31,reasonable,合理的な、手頃な,The price is reasonable.,その価格は手頃だ。,【対義語】unreasonable（不合理な）
34,clothes,衣服,I bought new clothes.,私は新しい服を買った。,
34,clothing,衣類,Warm clothing is necessary.,暖かい衣類が必要だ。,
34,collar,襟,He wore a shirt with a blue collar.,彼は青い襟のシャツを着ていた。,
34,convenience,便利さ,Convenience is important to customers.,便利さは顧客にとって重要だ。,
34,convenient,便利な,This store is convenient.,この店は便利だ。,【対義語】inconvenient（不便な）
34,discriminate,差別する、区別する,We must not discriminate against others.,他人を差別してはいけない。,
34,discrimination,差別,Racial discrimination is unfair.,人種差別は不公平だ。,
34,garment,衣服,The garment was made by hand.,その衣服は手作りだった。,
34,helpful,役に立つ、親切な,Your advice was very helpful.,あなたの助言はとても役に立った。,
34,inconvenient,不便な,The location is inconvenient.,その場所は不便だ。,【対義語】convenient（便利な）
34,majority,大多数,The majority agreed with the plan.,大多数がその計画に賛成した。,【対義語】minority（少数派）
34,though,～だけれども,"Though it was cold, we went out.",寒かったけれど、私たちは出かけた。,
34,whatever,何でも、どんな～でも,You can choose whatever you like.,好きなものを何でも選んでよい。,
35,afford,余裕がある,I can't afford a new car.,新車を買う余裕がない。,
35,expense,費用、出費,Travel expenses were high.,旅行費用は高かった。,
35,expensive,高価な,This watch is expensive.,この時計は高価だ。,【対義語】cheap（安い）
35,inexpensive,安価な,This restaurant is inexpensive.,このレストランは安価だ。,【対義語】expensive（高価な）
35,past,過去、過去の,We should learn from the past.,私たちは過去から学ぶべきだ。,【対義語】future（未来）
35,previous,前の、以前の,I remember the previous lesson.,私は前回の授業を覚えている。,【対義語】following（次の）
35,quite,かなり、まったく,It is quite difficult.,それはかなり難しい。,
35,servant,使用人,The servant cleaned the room.,使用人が部屋を掃除した。,
35,slave,奴隷,The slaves worked on the farm.,奴隷たちは農場で働いた。,
35,slavery,奴隷制度,Slavery was abolished.,奴隷制度は廃止された。,
35,wealth,富、財産,Health is greater than wealth.,健康は富に勝る。,
35,wealthy,裕福な、富んだ,He comes from a wealthy family.,彼は裕福な家庭の出身だ。,【対義語】poor（貧しい）
38,amount,量,The amount of rain increased.,雨量が増えた。,
38,clearly,明らかに、はっきりと,She spoke clearly.,彼女ははっきり話した。,
38,define,定義する,Please define this word.,この単語を定義してください。,
38,definite,明確な、確かな,We need a definite answer.,私たちは明確な答えが必要だ。,【対義語】vague（曖昧な）
38,definitely,確かに、絶対に,I will definitely come.,私は必ず来ます。,
38,definition,定義,What is the definition of this word?,この単語の定義は何ですか。,
38,even,～でさえ、平らな,Even children can understand it.,子供でさえそれを理解できる。,
38,formula,公式、決まり文句,Use this formula to solve the problem.,この問題を解くためにこの公式を使いなさい。,
38,formulate,明確に述べる、考案する,They formulated a new plan.,彼らは新しい計画を立てた。,
38,mean,意味する、意地悪な,What does this word mean?,この単語は何を意味しますか。,
38,mind,心、考え,Change your mind if necessary.,必要なら考えを変えなさい。,
38,theorem,定理,We learned a theorem in math.,私たちは数学で定理を学んだ。,
39,alone,一人で,She lives alone.,彼女は一人で暮らしている。,
39,divide,分ける,Divide the cake into four pieces.,ケーキを4つに分けなさい。,【対義語】unite（結合する）
39,division,分割、部門,The company has three divisions.,その会社には3つの部門がある。,
39,poison,毒、毒を盛る,This plant contains poison.,この植物には毒が含まれている。,
39,poisonous,有毒な,Some mushrooms are poisonous.,一部のキノコは有毒だ。,
39,separate,分ける、別々の,Separate the eggs from the milk.,卵を牛乳から分けなさい。,【対義語】combine（結合する）
39,split,分ける、分裂する,Split the group into two teams.,グループを2チームに分けなさい。,
40,addict,依存者,He is a game addict.,彼はゲーム依存者だ。,
40,addiction,依存,Internet addiction is a serious issue.,ネット依存は深刻な問題だ。,
40,alcohol,アルコール,Alcohol is prohibited here.,ここでは飲酒が禁止されている。,
40,alcoholic,アルコール依存の,He is an alcoholic.,彼はアルコール依存症だ。,
40,careful,注意深い,Be careful when you cross the street.,道を渡るときは注意しなさい。,【対義語】careless（不注意な）
40,carefully,注意深く,Read the instructions carefully.,説明を注意深く読みなさい。,
40,careless,不注意な,It was a careless mistake.,それは不注意なミスだった。,【対義語】careful（注意深い）
40,control,支配する、管理する,Control your emotions.,感情を抑えなさい。,
40,instance,例、場合,This is one instance of the problem.,これはその問題の一例だ。,
40,specimen,標本、見本,The scientist examined the specimen.,科学者は標本を調べた。,
41,depend,頼る、依存する,Children depend on their parents.,子供は親に頼る。,
41,dependence,依存,His dependence on others is strong.,彼の他人への依存は強い。,【対義語】independence（独立）
41,dependent,依存している,She is dependent on her family.,彼女は家族に依存している。,【対義語】independent（独立した）
41,independence,独立,They fought for independence.,彼らは独立のために戦った。,【対義語】dependence（依存）
41,independent,独立した,She wants to be independent.,彼女は独立したいと思っている。,【対義語】dependent（依存した）
41,parasite,寄生虫,A parasite lives in another organism.,寄生虫は別の生物の中で生きる。,
44,claim,主張する、要求する,He claimed that he was innocent.,彼は無実だと主張した。,
44,demand,要求する、需要,They demanded an explanation.,彼らは説明を要求した。,
44,effective,効果的な,This method is effective.,この方法は効果的だ。,【対義語】ineffective（効果のない）
44,effectively,効果的に,She managed the team effectively.,彼女はチームを効果的に管理した。,
44,effectiveness,有効性、効果,The effectiveness of the method was clear.,その方法の有効性は明らかだった。,
44,efficiency,効率,We need to improve efficiency.,私たちは効率を改善する必要がある。,
44,efficient,効率的な,This machine is very efficient.,この機械はとても効率的だ。,【対義語】inefficient（非効率な）
44,efficiently,効率的に,She finished the work efficiently.,彼女は仕事を効率的に終えた。,
44,FALSE,誤った、偽の,That statement is false.,その発言は誤りだ。,【対義語】true（真実の）
44,fault,欠点、責任,It was my fault.,それは私の責任だった。,
44,inefficient,非効率な,The old system is inefficient.,古い制度は非効率だ。,【対義語】efficient（効率的な）
44,mask,仮面、覆い隠す,Wear a mask in the hospital.,病院ではマスクを着けなさい。,
44,supply,供給する、供給,The company supplies water.,その会社は水を供給している。,
45,cheek,頬,She kissed him on the cheek.,彼女は彼の頬にキスをした。,
45,disprove,誤りを証明する,The experiment disproved the theory.,その実験は理論の誤りを証明した。,【対義語】prove（証明する）
45,downward,下向きの、下方へ,The graph shows a downward trend.,グラフは下向きの傾向を示している。,【対義語】upward（上向きの）
45,eyebrow,眉,She raised her eyebrows.,彼女は眉を上げた。,
45,prove,証明する,The data proves the theory.,そのデータは理論を証明している。,【対義語】disprove（誤りを証明する）
45,pull,引く,Pull the door to open it.,ドアを開けるには引きなさい。,【対義語】push（押す）
45,slight,わずかな、軽い,There was a slight difference.,わずかな違いがあった。,
45,slightly,わずかに,The price increased slightly.,価格はわずかに上がった。,
45,surround,囲む,Trees surround the house.,木々がその家を囲んでいる。,
45,surrounding,周囲の、周辺の,The surrounding area is quiet.,周辺地域は静かだ。,
45,tighten,締める、きつくする,Tighten the screw.,ねじを締めなさい。,【対義語】loosen（緩める）
45,upward,上向きの、上方へ,The arrow points upward.,矢印は上を向いている。,【対義語】downward（下向きの）
48,basic,基本的な,These are basic rules.,これらは基本的な規則だ。,【対義語】advanced（高度な）
48,behave,振る舞う,Please behave well in class.,授業中はきちんと振る舞ってください。,
48,behavior,行動、振る舞い,His behavior was polite.,彼の振る舞いは礼儀正しかった。,
48,behavioral,行動の、行動に関する,The study focuses on behavioral change.,その研究は行動の変化に焦点を当てている。,
48,cell,細胞、独房,The human body has many cells.,人体には多くの細胞がある。,
48,cellular,細胞の,Cellular activity changes with temperature.,細胞活動は温度によって変化する。,
48,DNA,DNA、デオキシリボ核酸,DNA contains genetic information.,DNAは遺伝情報を含んでいる。,
48,experiment,実験,We did a science experiment.,私たちは理科の実験をした。,
48,experimental,実験の、実験的な,This is an experimental method.,これは実験的な方法だ。,
48,gene,遺伝子,Genes affect our bodies.,遺伝子は私たちの体に影響する。,
48,genetic,遺伝の,Genetic factors affect health.,遺伝的要因は健康に影響する。,
48,genome,ゲノム,Scientists studied the human genome.,科学者たちはヒトゲノムを研究した。,
48,pass,通る、合格する,She passed the exam.,彼女は試験に合格した。,【対義語】fail（失敗する、不合格になる）
48,replicate,複製する、再現する,They replicated the experiment.,彼らはその実験を再現した。,
48,simulate,シミュレーションする、まねる,The program simulates weather patterns.,そのプログラムは気象パターンをシミュレーションする。,
49,act,行動する,You need to act now.,今行動する必要がある。,
49,action,行動,Action is better than words.,行動は言葉に勝る。,
49,basis,基礎、根拠,Trust is the basis of friendship.,信頼は友情の基礎だ。,
49,deed,行為、証書,A kind deed can change someone's day.,親切な行為は誰かの一日を変えうる。,
49,dislike,嫌う,I dislike cold weather.,私は寒い天気が嫌いだ。,【対義語】like（好む）
49,end,終わる、終わり,The meeting ended at five.,会議は5時に終わった。,【対義語】begin（始まる）
49,like,好む、～のような,I like this song.,私はこの歌が好きだ。,【対義語】dislike（嫌う）
49,premise,前提,The argument is based on a false premise.,その議論は誤った前提に基づいている。,
49,research,研究、調査,They conduct research on climate change.,彼らは気候変動について研究している。,
49,researcher,研究者,The researcher collected data.,研究者はデータを集めた。,
50,differ,異なる,Their opinions differ.,彼らの意見は異なる。,
50,partial,部分的な、偏った,This is only a partial solution.,これは部分的な解決にすぎない。,【対義語】complete（完全な）
50,partially,部分的に,The road was partially closed.,その道は部分的に閉鎖された。,
50,particular,特定の、特別な,I need a particular book.,特定の本が必要だ。,
50,particularly,特に,This area is particularly cold.,この地域は特に寒い。,
50,partly,部分的に、ある程度,The result was partly correct.,その答えは部分的に正しかった。,
50,survey,調査、調査する,We conducted a survey.,私たちは調査を行った。,
50,variable,変わりやすい、変数,The weather is variable in spring.,春の天気は変わりやすい。,
50,variation,変化、変種,There is wide variation in size.,大きさには大きな違いがある。,
50,variety,多様性、種類,The store sells a variety of goods.,その店はさまざまな商品を売っている。,
50,various,さまざまな,We discussed various topics.,私たちはさまざまな話題を議論した。,
50,vary,変わる、異なる,Prices vary by region.,価格は地域によって異なる。,
51,explain,説明する,Please explain the rule.,その規則を説明してください。,
51,explanation,説明,His explanation was clear.,彼の説明は明確だった。,
51,flu,インフルエンザ,He has the flu.,彼はインフルエンザにかかっている。,
51,influence,影響、影響を与える,His words influenced many people.,彼の言葉は多くの人に影響を与えた。,
51,influential,影響力のある,She is an influential leader.,彼女は影響力のある指導者だ。,
51,narrative,物語、語り,The novel has a complex narrative.,その小説には複雑な語りがある。,
51,proposition,提案、命題,He made a clear proposition.,彼は明確な提案をした。,
51,suggest,提案する、示唆する,I suggest taking a break.,休憩することを提案します。,
51,suggestion,提案,Thank you for your suggestion.,提案してくれてありがとう。,
54,bias,偏見、先入観,We should avoid bias.,私たちは偏見を避けるべきだ。,
54,biased,偏った、偏見を持った,The report was biased.,その報告は偏っていた。,【対義語】unbiased（偏りのない）
54,deepen,深める,The experience deepened their friendship.,その経験は彼らの友情を深めた。,
54,deeply,深く,She was deeply moved.,彼女は深く感動した。,
54,gender,性別,Gender equality is important.,男女平等は重要だ。,
54,prejudice,偏見,We should fight prejudice.,私たちは偏見と戦うべきだ。,
54,root,根、根源,The tree has deep roots.,その木には深い根がある。,
54,sex,性別、性,Sex differences were studied.,性差が研究された。,
54,shallow,浅い,The river is shallow here.,この川はここでは浅い。,【対義語】deep（深い）
54,stem,茎、由来する,The flower has a long stem.,その花には長い茎がある。,
54,stereotype,固定観念、型にはまった見方,We should avoid stereotypes.,固定観念は避けるべきだ。,
54,trunk,幹、胴体、トランク,The elephant has a long trunk.,ゾウには長い鼻がある。,
55,amaze,驚かせる,The news amazed everyone.,そのニュースは皆を驚かせた。,
55,amazing,驚くべき,The view was amazing.,その景色は素晴らしかった。,
55,fix,修理する、固定する,Can you fix this computer?,このコンピューターを直せますか。,
55,fixed,固定された、決まった,The price is fixed.,価格は固定されている。,
55,inclination,傾向、傾き,She has an inclination to worry.,彼女には心配しがちな傾向がある。,
55,incline,傾く、傾ける,The road inclines upward.,道は上向きに傾いている。,
55,pin,ピン、留める,Use a pin to hold the paper.,紙を留めるためにピンを使いなさい。,
55,startle,びっくりさせる,The loud noise startled me.,大きな音が私をびっくりさせた。,
55,tend,傾向がある、世話をする,Children tend to learn quickly.,子供は早く学ぶ傾向がある。,
55,tendency,傾向,He has a tendency to worry.,彼には心配しがちな傾向がある。,
55,view,眺め、見方、見る,The room has a beautiful view.,その部屋からは美しい眺めが見える。,
56,alike,似ている,The two brothers look alike.,その二人の兄弟はよく似ている。,
