205,tutor,家庭教師、指導教員,My tutor helped me with math.,家庭教師が数学を手伝ってくれた。,
206,bond,絆、結束,A strong bond developed between them.,彼らの間に強い絆が生まれた。,
206,complain,不平を言う,He complained about the noise.,彼は騒音に文句を言った。,
206,complaint,苦情、不満,We received a complaint.,私たちは苦情を受けた。,
206,emerge,現れる、明らかになる,A new problem emerged.,新たな問題が現れた。,
206,emergence,出現,The emergence of AI changed society.,AIの出現は社会を変えた。,
206,emergency,緊急事態,This is an emergency.,これは緊急事態だ。,
206,examine,調べる、診察する,The doctor examined the patient.,医師は患者を診察した。,
206,relationship,関係,They have a good relationship.,彼らはよい関係を持っている。,
206,slip,滑る、滑り落ちる,He slipped on the ice.,彼は氷の上で滑った。,
206,urge,強く促す、衝動,I urged him to study harder.,私は彼にもっと勉強するよう強く促した。,
206,urgency,緊急性,There is a sense of urgency.,緊急性が感じられる。,
206,urgent,緊急の,This is an urgent matter.,これは緊急の問題だ。,
207,blog,ブログ,She writes a travel blog.,彼女は旅行ブログを書いている。,
207,coexist,共存する,Different cultures can coexist.,異なる文化は共存できる。,
207,exist,存在する,Many problems still exist.,多くの問題がまだ存在している。,
207,existence,存在,They questioned the existence of life on Mars.,彼らは火星の生命の存在を疑問視した。,
207,importance,重要性,We understand the importance of sleep.,私たちは睡眠の重要性を理解している。,
207,journal,日記、専門誌,She wrote in her journal.,彼女は日記を書いた。,
207,journalism,ジャーナリズム、報道,He studies journalism.,彼はジャーナリズムを学んでいる。,
207,preference,好み、優先,Do you have a preference?,何か好みはありますか。,
207,quality,質、品質,The quality of this product is high.,この製品の品質は高い。,
208,angle,角度,The angle is 90 degrees.,その角度は90度だ。,
208,arrow,矢,The arrow hit the target.,矢は的に当たった。,
208,bargain,安い買い物、交渉する,This jacket was a bargain.,この上着はお買い得だった。,
208,booth,小さな売店、ブース,We visited the information booth.,私たちは案内ブースを訪れた。,
208,championship,選手権、優勝,They won the championship.,彼らは選手権で優勝した。,
208,gasoline,ガソリン,The car needs gasoline.,その車にはガソリンが必要だ。,
208,hammer,金づち、打つ,He used a hammer.,彼は金づちを使った。,
208,jar,瓶、つぼ,She opened a jar of jam.,彼女はジャムの瓶を開けた。,
208,keyboard,キーボード,She typed on the keyboard.,彼女はキーボードで入力した。,
208,laptop,ノートパソコン,I use a laptop for work.,私は仕事でノートパソコンを使う。,
208,league,リーグ、連盟,He plays in a soccer league.,彼はサッカーリーグでプレーしている。,
208,lens,レンズ,Clean the camera lens.,カメラのレンズを拭きなさい。,
208,magnet,磁石,A magnet attracts iron.,磁石は鉄を引きつける。,
208,magnetic,磁気の、磁石の,The earth has a magnetic field.,地球には磁場がある。,
208,pause,一時停止する、一休みする,She paused before answering.,彼女は答える前に少し間を置いた。,
208,scissors,はさみ,Use scissors to cut the paper.,紙を切るためにはさみを使いなさい。,
208,seminar,セミナー、講習会,I attended a seminar.,私はセミナーに参加した。,
208,sponge,スポンジ,A sponge absorbs water.,スポンジは水を吸収する。,
208,spray,吹きかける、スプレー,Spray water on the plants.,植物に水を吹きかけなさい。,
208,studio,スタジオ、仕事場,The artist works in a studio.,その芸術家はスタジオで働いている。,
208,tape,テープ,Use tape to fix it.,それを固定するためにテープを使いなさい。,
208,workshop,作業場、研修会,We joined a writing workshop.,私たちは文章講座に参加した。,
212,block,妨げる、ふさぐ、区画,A fallen tree blocked the road.,倒れた木が道をふさいだ。,
212,bulk,大部分、大量,The bulk of the work is done.,仕事の大部分は終わった。,
212,chunk,大きなかたまり,He cut the meat into chunks.,彼は肉を大きなかたまりに切った。,
212,evolution,進化,Evolution takes a long time.,進化には長い時間がかかる。,
212,evolutionary,進化の,This is an evolutionary change.,これは進化上の変化だ。,
212,evolve,進化する、発展する,Language continues to evolve.,言語は進化し続ける。,
212,fossil,化石,They found a dinosaur fossil.,彼らは恐竜の化石を発見した。,
212,fuel,燃料,Gasoline is used as fuel.,ガソリンは燃料として使われる。,
212,grid,格子、送電網,The city is built on a grid.,その都市は格子状に作られている。,
212,hydrogen,水素,Hydrogen is a light gas.,水素は軽い気体だ。,
212,nuclear,核の、原子力の,Nuclear energy is controversial.,原子力エネルギーは議論を呼ぶ。,
212,nucleus,核、中心,The nucleus is the center of an atom.,原子核は原子の中心である。,
212,radiation,放射線、放射,Too much radiation is dangerous.,過度の放射線は危険だ。,
213,astronomer,天文学者,The astronomer observed the stars.,その天文学者は星を観測した。,
213,astronomical,天文学の、非常に大きな,The project cost an astronomical amount.,その計画には莫大な費用がかかった。,
213,astronomy,天文学,She studies astronomy.,彼女は天文学を学んでいる。,
213,comet,彗星,We saw a comet in the sky.,空に彗星が見えた。,
213,component,部品、構成要素,Each component is important.,各構成要素は重要だ。,
213,cosmic,宇宙の,Cosmic rays come from space.,宇宙線は宇宙から来る。,
213,cosmos,宇宙,The cosmos is vast.,宇宙は広大だ。,
213,element,要素、元素,Trust is an important element.,信頼は重要な要素だ。,
213,embrace,受け入れる、抱きしめる,They embraced the new idea.,彼らは新しい考えを受け入れた。,
213,galaxy,銀河,The Milky Way is a galaxy.,天の川は銀河である。,
213,grab,つかむ,He grabbed my hand.,彼は私の手をつかんだ。,
213,graphic,図表の、写実的な,The report includes graphic data.,その報告書には図表データが含まれている。,
213,grip,握る、握力,She kept a firm grip on the rope.,彼女はロープをしっかり握った。,
213,lunar,月の、月に関する,The lunar surface is covered with dust.,月面はほこりで覆われている。,
213,seize,つかむ、押収する,The police seized the drugs.,警察は薬物を押収した。,
214,actual,実際の,The actual cost was higher.,実際の費用はもっと高かった。,
214,breakthrough,大きな進歩、突破口,The research led to a breakthrough.,その研究は大きな進歩につながった。,
214,discover,発見する,Scientists discovered a new planet.,科学者たちは新しい惑星を発見した。,
214,discovery,発見,The discovery changed science.,その発見は科学を変えた。,
214,earn,稼ぐ、得る,He earns enough money.,彼は十分なお金を稼いでいる。,
214,earnings,収入、利益,Her earnings increased this year.,彼女の収入は今年増えた。,
214,encounter,出会う、遭遇する,We encountered many problems.,私たちは多くの問題に遭遇した。,
214,income,収入,His income increased.,彼の収入は増えた。,
214,indeed,実際に、本当に,It was indeed a difficult task.,それは本当に難しい仕事だった。,
214,tax,税、税金,We pay income tax.,私たちは所得税を払う。,
214,witness,目撃者、目撃する,She witnessed the accident.,彼女はその事故を目撃した。,
215,content,内容、中身,The content of the book is useful.,その本の内容は役に立つ。,
215,fulfill,果たす、満たす,She fulfilled her promise.,彼女は約束を果たした。,
215,fulfillment,実現、達成,He felt fulfillment after the work.,彼は仕事の後に達成感を覚えた。,
215,satisfaction,満足,Customer satisfaction is important.,顧客満足は重要だ。,
215,satisfactory,満足のいく,The result was satisfactory.,結果は満足のいくものだった。,
215,satisfy,満足させる,The answer satisfied everyone.,その答えは皆を満足させた。,
215,thesis,論文、主張,She wrote a thesis on history.,彼女は歴史について論文を書いた。,
218,autobiography,自伝,I read his autobiography.,私は彼の自伝を読んだ。,
218,biography,伝記,I read a biography of the scientist.,私はその科学者の伝記を読んだ。,
218,delay,遅れ、遅らせる,The train was delayed.,電車は遅れた。,
218,die,死ぬ,Many plants died in the heat.,多くの植物が暑さで枯れた。,【対義語】live（生きる）
218,equip,装備する,The school equipped the lab with computers.,学校は実験室にコンピューターを備えた。,
218,equipment,設備、装備,The equipment is expensive.,その設備は高価だ。,
218,funeral,葬式,Many people attended the funeral.,多くの人が葬式に参列した。,
218,gifted,才能のある,She is a gifted pianist.,彼女は才能あるピアニストだ。,
218,later,後で、後の,I will call you later.,後であなたに電話します。,【対義語】earlier（より早く）
218,postpone,延期する,They postponed the meeting.,彼らは会議を延期した。,
218,thrive,繁栄する、よく育つ,Plants thrive in warm weather.,植物は暖かい天候でよく育つ。,
218,tomb,墓,The king was buried in a tomb.,王は墓に埋葬された。,
219,adore,とても好きである、崇拝する,Children adore the character.,子供たちはそのキャラクターが大好きだ。,
219,advance,前進する、進歩する,Technology advances rapidly.,技術は急速に進歩する。,
219,advanced,高度な、先進的な,She is taking an advanced course.,彼女は上級コースを受講している。,
219,creep,はう、忍び寄る,The cat crept under the table.,猫はテーブルの下に忍び込んだ。,
219,humiliate,恥をかかせる,Do not humiliate others.,他人に恥をかかせてはいけない。,
219,intermediate,中間の、中級の,This is an intermediate course.,これは中級コースだ。,
219,physician,医師,The physician examined the patient.,医師は患者を診察した。,
219,physicist,物理学者,The physicist studied energy.,その物理学者はエネルギーを研究した。,
219,physics,物理学,Physics explains natural laws.,物理学は自然法則を説明する。,
219,scholarship,奨学金,She won a scholarship.,彼女は奨学金を得た。,
219,sneak,こっそり動く、忍び込む,The cat sneaked into the room.,猫が部屋にこっそり入った。,
219,worship,崇拝する、礼拝する,They worship at the temple.,彼らは寺で礼拝する。,
220,gaze,じっと見る,She gazed at the stars.,彼女は星をじっと見つめた。,
220,humiliation,屈辱,He felt deep humiliation.,彼は深い屈辱を感じた。,
220,insult,侮辱する、侮辱,He insulted his friend.,彼は友人を侮辱した。,
220,lecture,講義,The lecture was interesting.,その講義は面白かった。,
220,lecturer,講師,The lecturer explained the topic clearly.,講師はその話題を明確に説明した。,
220,regulate,規制する、調整する,The law regulates pollution.,法律は汚染を規制している。,
220,regulation,規則、規制,You must follow the regulations.,規則に従わなければならない。,
220,relate,関連づける、関係する,This story relates to our topic.,この話は私たちの話題に関係している。,
220,related,関連した,These two problems are related.,この二つの問題は関連している。,
220,relation,関係、関連,There is a relation between diet and health.,食事と健康には関係がある。,
220,require,必要とする,This job requires experience.,この仕事には経験が必要だ。,
220,requirement,必要条件,English is a requirement for the job.,英語はその仕事の必要条件だ。,
220,unrelated,無関係の,The two events are unrelated.,その二つの出来事は無関係だ。,【対義語】related（関連した）
221,applause,拍手,The speech received loud applause.,その演説は大きな拍手を受けた。,
221,celebrate,祝う,We celebrated her birthday.,私たちは彼女の誕生日を祝った。,
221,celebration,祝い、祝賀,The celebration lasted all night.,祝賀は一晩中続いた。,
221,glance,ちらっと見る,He glanced at his watch.,彼は時計をちらっと見た。,
221,greet,挨拶する,She greeted me with a smile.,彼女は笑顔で私に挨拶した。,
221,loud,大きな音の、うるさい,The music was too loud.,音楽が大きすぎた。,【対義語】quiet（静かな）
221,regularly,定期的に,She exercises regularly.,彼女は定期的に運動している。,
221,sink,沈む,The stone sank in the water.,石は水に沈んだ。,【対義語】float（浮く）
221,stare,じっと見る,Do not stare at people.,人をじっと見てはいけない。,
224,calm,落ち着いた、落ち着かせる,Stay calm in an emergency.,緊急時には落ち着いていなさい。,【対義語】anxious（不安な）
224,calmly,落ち着いて,She answered calmly.,彼女は落ち着いて答えた。,
224,foul,汚い、不正な,The player made a foul move.,その選手は反則行為をした。,
224,inject,注射する、注入する,The doctor injected the medicine.,医師は薬を注射した。,
224,mess,混乱、散らかった状態,My room is a mess.,私の部屋は散らかっている。,
224,messy,散らかった、乱雑な,His desk is messy.,彼の机は散らかっている。,【対義語】neat（きちんとした）
224,nasty,不快な、意地悪な,He made a nasty comment.,彼は不快な発言をした。,
224,needle,針,The nurse used a needle.,看護師は針を使った。,
224,pierce,突き刺す、貫く,The needle pierced the cloth.,針が布を貫いた。,
224,pump,ポンプ、くみ上げる,The pump moves water.,ポンプは水を動かす。,
224,stick,棒、くっつく,The paper stuck to the wall.,その紙は壁にくっついた。,
224,sticky,べたべたする,The table is sticky.,そのテーブルはべたべたしている。,
225,aim,目指す、目的,We aim to win the game.,私たちは試合に勝つことを目指している。,
225,bone,骨,He broke a bone in his arm.,彼は腕の骨を折った。,
225,flesh,肉、身体,The wound cut into the flesh.,傷は肉まで達した。,
225,joint,共同の、関節,They made a joint decision.,彼らは共同で決定した。,
225,knot,結び目,Tie a knot in the rope.,ロープに結び目を作りなさい。,
225,resilience,回復力、しなやかさ,Children often show resilience.,子供はしばしば回復力を示す。,
225,resilient,回復力のある、弾力のある,She is resilient under stress.,彼女はストレス下でも立ち直る力がある。,
225,restoration,修復、復元,The restoration of the temple took years.,その寺の修復には何年もかかった。,
225,restore,回復する、修復する,They restored the old building.,彼らは古い建物を修復した。,
225,sake,目的、理由,"For your sake, I will help.",あなたのために私は助けます。,
225,stress,ストレス、強調する,Stress can affect health.,ストレスは健康に影響することがある。,
225,stressful,ストレスの多い,The job is stressful.,その仕事はストレスが多い。,
226,abuse,乱用する、虐待する,Do not abuse your authority.,権限を乱用してはいけない。,
226,chief,主要な、長,The chief reason is cost.,主な理由は費用だ。,
226,cruel,残酷な,It was a cruel act.,それは残酷な行為だった。,【対義語】kind（親切な）
226,cruelty,残酷さ、残虐行為,Animal cruelty should be stopped.,動物への残虐行為は止めるべきだ。,
226,intention,意図、つもり,I had no intention of hurting you.,あなたを傷つけるつもりはなかった。,
226,intentional,意図的な、故意の,It was not intentional.,それは故意ではなかった。,【対義語】accidental（偶然の）
226,intentionally,意図的に、故意に,He intentionally ignored the rule.,彼は意図的にその規則を無視した。,
226,major,主要な、大きな,This is a major problem.,これは大きな問題だ。,【対義語】minor（小さい、重要でない）
226,opinion,意見,What is your opinion?,あなたの意見は何ですか。,
226,random,無作為の、でたらめな,Choose a random number.,無作為に数字を選びなさい。,
226,reflect,反映する、反射する,The mirror reflects light.,鏡は光を反射する。,
226,reflection,反射、反映,Her essay was a reflection of her experience.,彼女の作文は経験の反映だった。,
227,biodiversity,生物多様性,We must protect biodiversity.,私たちは生物多様性を守らなければならない。,
227,cope,対処する,She coped with the stress.,彼女はそのストレスに対処した。,
227,deal,扱う、取引する,We must deal with the problem.,私たちはその問題に対処しなければならない。,
227,diverse,多様な,The city has diverse cultures.,その都市には多様な文化がある。,
227,diversify,多様化する,The company diversified its business.,その会社は事業を多様化した。,
227,diversity,多様性,Diversity makes society stronger.,多様性は社会をより強くする。,
227,perspective,観点、見方,Try to see it from another perspective.,別の観点からそれを見てみなさい。,
227,thought,考え、思考,I had a strange thought.,私は奇妙な考えを持った。,
227,viewpoint,観点、見方,Try to understand his viewpoint.,彼の観点を理解しようとしなさい。,
228,cite,引用する、挙げる,Please cite your sources.,出典を引用してください。,
228,demonstrate,示す、実演する,The teacher demonstrated the experiment.,先生は実験を実演した。,
228,demonstration,実演、デモ,The demonstration was clear.,その実演は分かりやすかった。,
228,fame,名声,She gained fame as a singer.,彼女は歌手として名声を得た。,
228,famous,有名な,He is a famous actor.,彼は有名な俳優だ。,【対義語】unknown（無名の）
228,mindset,考え方、心構え,A growth mindset is important.,成長志向の考え方は重要だ。,
228,morally,道徳的に,"Morally, the decision was wrong.",道徳的に、その決定は間違っていた。,
228,prospect,見込み、展望,The prospect of success is high.,成功の見込みは高い。,
228,prospective,見込みのある、将来の,Prospective students visited the school.,入学希望者が学校を訪れた。,
228,quotation,引用、見積もり,The essay begins with a quotation.,そのエッセイは引用で始まる。,
228,quote,引用する,She quoted a famous writer.,彼女は有名な作家を引用した。,
228,spectator,観客,Many spectators watched the game.,多くの観客が試合を見た。,
229,approval,承認,The plan received approval.,その計画は承認を得た。,
229,approve,承認する,The committee approved the proposal.,委員会は提案を承認した。,【対義語】reject（拒否する）
229,condemn,非難する,Many people condemned the violence.,多くの人がその暴力を非難した。,【対義語】praise（称賛する）
229,defend,守る、弁護する,They defended their country.,彼らは国を守った。,【対義語】attack（攻撃する）
229,defense,防御、弁護,The team has a strong defense.,そのチームは守備が強い。,【対義語】attack（攻撃）
229,defensive,防御的な、守備の,He became defensive.,彼は守りの姿勢になった。,
229,democracy,民主主義,Democracy protects citizens' rights.,民主主義は市民の権利を守る。,
229,democratic,民主的な,They held a democratic election.,彼らは民主的な選挙を行った。,
229,disapprove,反対する、認めない,My parents disapproved of the plan.,両親はその計画に反対した。,【対義語】approve（承認する）
229,liberal,自由主義の、寛大な,She has liberal views.,彼女は自由主義的な考えを持っている。,
229,liberate,解放する,The army liberated the town.,軍はその町を解放した。,【対義語】oppress（抑圧する）
229,liberty,自由,They fought for liberty.,彼らは自由のために戦った。,
229,republic,共和国,France is a republic.,フランスは共和国だ。,
229,shield,盾、防ぐ,The shield protected him.,盾が彼を守った。,
229,surface,表面、水面,The surface of the lake was calm.,湖の表面は穏やかだった。,
229,sword,剣,The knight carried a sword.,騎士は剣を持っていた。,
232,abandon,～を捨てる、放棄する,They abandoned the plan.,彼らはその計画を断念した。,【対義語】maintain（維持する）
232,amend,修正する,The law was amended.,その法律は改正された。,
232,amendment,修正、改正,The amendment was approved.,その改正案は承認された。,
232,ignorance,無知,His mistake came from ignorance.,彼のミスは無知から来ていた。,
232,ignorant,無知な,He was ignorant of the facts.,彼は事実を知らなかった。,
232,ignore,無視する,Do not ignore the warning.,警告を無視してはいけない。,
232,mend,修理する、直す,She mended her shirt.,彼女はシャツを直した。,
232,miss,逃す、恋しく思う,I missed the train.,私は電車に乗り遅れた。,
232,neglect,無視する、怠る,Do not neglect your health.,健康をおろそかにしてはいけない。,
232,quiet,静かな,Please be quiet.,静かにしてください。,【対義語】noisy（騒がしい）
232,quietly,静かに,She opened the door quietly.,彼女は静かにドアを開けた。,
232,whisper,ささやく、ささやき,She whispered in my ear.,彼女は私の耳元でささやいた。,
233,ability,能力,She has the ability to solve problems.,彼女には問題を解決する能力がある。,
233,capable,能力がある,She is capable of solving the problem.,彼女はその問題を解決する能力がある。,【対義語】incapable（能力がない）
233,capacity,能力、収容力,The hall has a capacity of 500 people.,そのホールは500人を収容できる。,
233,damage,損害、損傷を与える,The storm caused serious damage.,嵐は深刻な被害をもたらした。,
233,delicate,繊細な、微妙な,Be careful with this delicate glass.,この繊細なグラスには注意してください。,
233,fragile,壊れやすい、もろい,This glass is fragile.,このグラスは壊れやすい。,【対義語】strong（丈夫な）
233,inability,できないこと、無能力,His inability to speak surprised us.,彼が話せないことに私たちは驚いた。,【対義語】ability（能力）
233,incapable,能力がない,He is incapable of lying.,彼は嘘をつくことができない。,【対義語】capable（能力がある）
233,injure,けがをさせる,He injured his leg.,彼は足にけがをした。,
233,injury,けが、負傷,Her injury was serious.,彼女のけがは深刻だった。,
233,scar,傷跡,The injury left a scar.,そのけがは傷跡を残した。,
233,vulnerable,傷つきやすい、攻撃されやすい,Children are vulnerable to disease.,子供は病気にかかりやすい。,
236,activate,活性化する,The button activates the system.,そのボタンでシステムが起動する。,【対義語】deactivate（停止する）
236,active,活発な,She is active in sports.,彼女はスポーツで活発だ。,【対義語】inactive（不活発な）
236,activist,活動家,He is an environmental activist.,彼は環境活動家だ。,
236,article,記事、品物,I read an interesting article.,私は興味深い記事を読んだ。,
236,conclude,結論づける、終える,The report concluded that action was needed.,報告書は対策が必要だと結論づけた。,
236,conclusion,結論,We reached the same conclusion.,私たちは同じ結論に達した。,
236,inactive,不活発な,The account is inactive.,そのアカウントは使われていない。,【対義語】active（活発な）
236,investigate,調査する、捜査する,The police investigated the case.,警察はその事件を捜査した。,
236,investigation,調査、捜査,The investigation continued for months.,調査は数か月続いた。,
236,investigator,調査員、捜査官,The investigator found new evidence.,捜査官は新しい証拠を見つけた。,
236,observation,観察,The observation took one hour.,その観察には1時間かかった。,
236,observe,観察する、気づく,Scientists observed the birds.,科学者たちは鳥を観察した。,
236,observer,観察者,The observer recorded the results.,観察者は結果を記録した。,
236,summarize,要約する,Please summarize the article.,その記事を要約してください。,
237,attack,攻撃する、攻撃,The army launched an attack.,軍は攻撃を開始した。,
