117,salty,塩辛い,This soup is too salty.,このスープは塩辛すぎる。,
117,sugary,砂糖の多い、甘い,Avoid too many sugary drinks.,甘い飲み物を取りすぎないようにしなさい。,
117,toe,足の指,He hurt his toe.,彼は足の指を痛めた。,
120,antibiotic,抗生物質,The doctor prescribed an antibiotic.,医師は抗生物質を処方した。,
120,drugstore,薬局,I bought medicine at the drugstore.,私は薬局で薬を買った。,
120,fiction,小説、作り話,She likes science fiction.,彼女はSF小説が好きだ。,【対義語】fact（事実）
120,fictional,架空の,The story has fictional characters.,その物語には架空の登場人物がいる。,
120,folk,人々、民間の,This is a folk song.,これは民謡だ。,
120,folklore,民間伝承,Japanese folklore has many stories.,日本の民間伝承には多くの物語がある。,
120,myth,神話、作り話,That story is a Greek myth.,その話はギリシャ神話だ。,
120,pharmaceutical,製薬の、薬学の,She works for a pharmaceutical company.,彼女は製薬会社で働いている。,
120,pharmacy,薬局、薬学,I bought medicine at the pharmacy.,私は薬局で薬を買った。,
120,prescribe,処方する,The doctor prescribed medicine.,医師は薬を処方した。,
120,prescription,処方箋、処方,You need a prescription for this medicine.,この薬には処方箋が必要だ。,
120,remedy,治療法、解決策,This medicine is a remedy for pain.,この薬は痛みの治療法だ。,
120,widespread,広範囲にわたる、広く普及した,The disease became widespread.,その病気は広範囲に広がった。,
121,comfort,快適さ、慰め,This chair gives comfort.,この椅子は快適さを与える。,
121,comfortably,快適に,She sat comfortably on the sofa.,彼女はソファに快適に座った。,
121,decline,減少する、断る,Sales began to decline.,売上は減少し始めた。,【対義語】increase（増加する）
121,discomfort,不快感,He felt discomfort in his stomach.,彼は胃に不快感を覚えた。,【対義語】comfort（快適さ）
121,eclipse,日食、月食,We watched a solar eclipse.,私たちは日食を見た。,
121,plot,筋、陰謀,The novel has an interesting plot.,その小説には面白い筋がある。,
121,reassure,安心させる,He reassured his daughter.,彼は娘を安心させた。,
121,reduce,減らす,We need to reduce waste.,私たちはごみを減らす必要がある。,【対義語】increase（増やす）
121,reduction,減少、削減,The reduction in cost was helpful.,費用の削減は役に立った。,
121,symptom,症状,Fever is a common symptom.,発熱は一般的な症状だ。,
121,tale,話、物語,She told an old tale.,彼女は昔話を語った。,
122,cabinet,戸棚、内閣,The documents are in the cabinet.,書類は戸棚の中にある。,
122,closet,クローゼット、押し入れ,My coat is in the closet.,私のコートはクローゼットにある。,
122,contain,含む,Orange juice contains vitamin C.,オレンジジュースにはビタミンCが含まれている。,
122,container,容器,Put the food in a container.,食べ物を容器に入れてください。,
122,cram,詰め込む、一夜漬けで勉強する,Students crammed for the exam.,学生たちは試験のために詰め込み勉強をした。,
122,cupboard,食器棚、戸棚,The cups are in the cupboard.,コップは食器棚にある。,
122,despite,～にもかかわらず,"Despite the rain, we went out.",雨にもかかわらず私たちは出かけた。,
122,pack,詰める、荷造りする,I packed my bag.,私はバッグに荷物を詰めた。,
122,scientific,科学の,This is a scientific study.,これは科学的研究だ。,
122,scientifically,科学的に,The result was scientifically proven.,その結果は科学的に証明された。,
122,squeeze,絞る、押し込む,Squeeze the lemon.,レモンを絞りなさい。,
123,add,加える,Add some salt to the soup.,スープに塩を加えなさい。,【対義語】remove（取り除く）
123,possibility,可能性,There is a possibility of rain.,雨の可能性がある。,
123,possibly,ひょっとすると、可能性として,She may possibly come.,彼女は来るかもしれない。,
123,somehow,どうにかして、なぜか,"Somehow, we finished on time.",どうにか時間通りに終えた。,
123,system,制度、仕組み,This system is easy to use.,この仕組みは使いやすい。,
123,systematic,体系的な、組織的な,We need a systematic approach.,体系的な取り組みが必要だ。,
126,announce,発表する,The company announced a new product.,その会社は新製品を発表した。,
126,asteroid,小惑星,Scientists discovered a new asteroid.,科学者たちは新しい小惑星を発見した。,
126,declaration,宣言、申告,The president made a declaration.,大統領は宣言を行った。,
126,declare,宣言する,They declared their independence.,彼らは独立を宣言した。,
126,inferior,劣った、下位の,This product is inferior to that one.,この製品はあれより劣っている。,【対義語】superior（優れた）
126,Mars,火星,Mars is called the red planet.,火星は赤い惑星と呼ばれる。,
126,planet,惑星,Earth is a planet.,地球は惑星だ。,
126,planetary,惑星の,They study planetary motion.,彼らは惑星の運動を研究している。,
126,store,店、保管する,Store the food in a cool place.,食べ物を涼しい場所に保管しなさい。,
126,straight,まっすぐな、直線の,Go straight ahead.,まっすぐ進みなさい。,【対義語】curved（曲がった）
126,superior,優れた、上位の,This product is superior to the old one.,この製品は旧型より優れている。,【対義語】inferior（劣った）
126,talented,才能のある,She is a talented singer.,彼女は才能のある歌手だ。,
126,turn,回る、順番,It is your turn.,あなたの番です。,
127,aircraft,航空機,The aircraft landed safely.,航空機は安全に着陸した。,
127,aviation,航空,He works in aviation.,彼は航空業界で働いている。,
127,backward,後ろ向きの、後方へ,He took a step backward.,彼は一歩後ろへ下がった。,【対義語】forward（前方へ）
127,ceiling,天井,The ceiling is very high.,天井はとても高い。,
127,conduct,行う、導く,They conducted an experiment.,彼らは実験を行った。,
127,flight,飛行、便,Our flight was delayed.,私たちの便は遅れた。,
127,frank,率直な,Please be frank with me.,私に率直に話してください。,
127,frankly,率直に,"Frankly, I disagree.",率直に言って、私は反対だ。,
127,lab,実験室、研究室,They worked in the lab.,彼らは実験室で働いた。,
127,laboratory,実験室、研究所,The sample was tested in a laboratory.,そのサンプルは実験室で検査された。,
127,perform,行う、演じる,She performed well on stage.,彼女は舞台でうまく演じた。,
127,performance,演技、実績、成績,His performance was excellent.,彼の成績は優れていた。,
128,dash,突進する、ダッシュする,She dashed to the station.,彼女は駅へ急いで走った。,
128,ethnic,民族の,Ethnic diversity is important.,民族的多様性は重要だ。,
128,ethnicity,民族性、民族集団,Ethnicity is part of identity.,民族性はアイデンティティの一部だ。,
128,institute,研究所、協会,He works at a research institute.,彼は研究所で働いている。,
128,institution,機関、制度,A school is an educational institution.,学校は教育機関である。,
128,race,人種、競走,He won the race.,彼は競走に勝った。,
128,racial,人種の,Racial discrimination is wrong.,人種差別は間違っている。,
128,racism,人種差別,We must fight racism.,私たちは人種差別と戦わなければならない。,
128,spot,場所、斑点、見つける,This is a good spot for photos.,ここは写真に良い場所だ。,
128,technological,技術の,Technological progress is rapid.,技術の進歩は急速だ。,
128,technology,技術、科学技術,Technology changes our lives.,技術は私たちの生活を変える。,
129,accuracy,正確さ,Accuracy is important in science.,科学では正確さが重要だ。,
129,accurate,正確な,The information is accurate.,その情報は正確だ。,【対義語】inaccurate（不正確な）
129,accurately,正確に,He described the event accurately.,彼はその出来事を正確に説明した。,
129,army,軍隊,He joined the army.,彼は軍隊に入隊した。,
129,exact,正確な,Tell me the exact time.,正確な時間を教えてください。,【対義語】approximate（おおよその）
129,inaccurate,不正確な,The information was inaccurate.,その情報は不正確だった。,【対義語】accurate（正確な）
129,marine,海の、海産の,Marine life is diverse.,海洋生物は多様だ。,
129,military,軍の、軍隊の,He entered military service.,彼は兵役に就いた。,
129,native,生まれつきの、現地の,English is his native language.,英語は彼の母語だ。,
129,navy,海軍,He joined the navy.,彼は海軍に入った。,
129,precise,正確な、精密な,We need precise data.,私たちは正確なデータが必要だ。,【対義語】vague（曖昧な）
129,precisely,正確に,The clock shows the time precisely.,その時計は時刻を正確に示す。,
129,precision,正確さ、精密さ,This machine works with high precision.,この機械は高い精度で動く。,
129,tribe,部族,The tribe lives near the river.,その部族は川の近くに住んでいる。,
130,creature,生き物、動物,Strange creatures live in the deep sea.,深海には奇妙な生き物が住んでいる。,
130,dangerous,危険な,That road is dangerous at night.,その道は夜は危険だ。,【対義語】safe（安全な）
130,device,装置、機器,This device is easy to use.,この装置は使いやすい。,
130,devise,考案する,They devised a new method.,彼らは新しい方法を考案した。,
130,earthquake,地震,The earthquake damaged many buildings.,その地震は多くの建物に被害を与えた。,
130,endanger,危険にさらす,Pollution endangers wildlife.,汚染は野生生物を危険にさらす。,
130,fierce,激しい、どう猛な,The storm was fierce.,嵐は激しかった。,
130,robotic,ロボットの、機械的な,Robotic technology is improving.,ロボット技術は進歩している。,
130,volcanic,火山の,Volcanic activity continues.,火山活動が続いている。,
130,volcano,火山,The volcano erupted last year.,その火山は昨年噴火した。,
131,collapse,崩壊する、倒れる,The old bridge collapsed.,古い橋が崩壊した。,
131,erupt,噴火する、突然起こる,The volcano erupted.,火山が噴火した。,
131,explode,爆発する,The bomb exploded suddenly.,爆弾が突然爆発した。,
131,explosion,爆発,The explosion damaged the building.,爆発で建物が損傷した。,
131,explosive,爆発性の、爆発物,Dynamite is explosive.,ダイナマイトは爆発性がある。,
131,extinct,絶滅した,Dinosaurs are extinct.,恐竜は絶滅している。,
131,extinction,絶滅,Many species face extinction.,多くの種が絶滅に直面している。,
131,mine,鉱山、私のもの,They worked in a coal mine.,彼らは炭鉱で働いていた。,
131,miner,鉱夫,The miner found gold.,その鉱夫は金を見つけた。,
134,avoid,避ける,Avoid making the same mistake.,同じ間違いを避けなさい。,
134,avoidance,回避,Avoidance of risk is important.,リスク回避は重要だ。,
134,cabin,小屋、船室、客室,We stayed in a small cabin.,私たちは小さな小屋に泊まった。,
134,chamber,部屋、会議室、室,The gas filled the chamber.,ガスがその部屋に充満した。,
134,envision,心に描く、想像する,We envision a better future.,私たちはより良い未来を思い描いている。,
134,frame,枠、骨組み,The picture is in a wooden frame.,その絵は木の額に入っている。,
134,framework,枠組み、構造,We need a clear framework.,明確な枠組みが必要だ。,
134,hut,小屋,They stayed in a small hut.,彼らは小さな小屋に泊まった。,
134,manipulate,操作する、巧みに扱う,He manipulated the data.,彼はデータを操作した。,
134,manipulation,操作、巧みな扱い,The manipulation of data is illegal.,データ操作は違法だ。,
134,mostly,主に、大部分は,The class is mostly students.,そのクラスは主に学生で構成されている。,
134,movement,動き、運動,The movement spread quickly.,その運動は急速に広がった。,
134,vision,視力、構想,He has a clear vision for the future.,彼には将来への明確な構想がある。,
134,visual,視覚の、目に見える,Visual information is easy to understand.,視覚情報は理解しやすい。,
135,bullet,弾丸,The bullet hit the wall.,弾丸は壁に当たった。,
135,bump,ぶつかる、こぶ,I bumped into the door.,私はドアにぶつかった。,
135,collide,衝突する,Two cars collided.,2台の車が衝突した。,
135,collision,衝突,The collision caused damage.,その衝突で損害が出た。,
135,crash,衝突する、墜落する,The car crashed into a tree.,車が木に衝突した。,
135,cue,合図、手がかり,That was my cue to leave.,それが私が去る合図だった。,
135,degree,程度、学位、度,The temperature rose by two degrees.,気温は2度上がった。,
135,pattern,模様、型、パターン,The shirt has a flower pattern.,そのシャツには花柄がある。,
135,refrain,控える、慎む,Please refrain from smoking.,喫煙は控えてください。,
135,trigger,引き起こす、きっかけ,The news triggered a debate.,そのニュースは議論を引き起こした。,
136,cargo,貨物,The ship carried heavy cargo.,その船は重い貨物を運んだ。,
136,clue,手がかり,The police found a clue.,警察は手がかりを見つけた。,
136,cortex,皮質,The brain cortex controls many functions.,大脳皮質は多くの機能を制御する。,
136,dozen,ダース、12個,I bought a dozen eggs.,私は卵を1ダース買った。,
136,function,機能、機能する,This machine has many functions.,この機械には多くの機能がある。,
136,functional,機能的な,The design is simple and functional.,そのデザインはシンプルで機能的だ。,
136,hint,ヒント、手がかり,Can you give me a hint?,ヒントをくれますか。,
136,load,荷物、積む,The truck carried a heavy load.,トラックは重い荷物を運んだ。,
136,organ,臓器、器官,The heart is an important organ.,心臓は重要な臓器だ。,
136,signal,信号、合図,The signal turned red.,信号が赤になった。,
136,tissue,組織、ティッシュ,Muscle is a kind of tissue.,筋肉は組織の一種だ。,
136,transplant,移植する、移植,The patient needed a heart transplant.,その患者には心臓移植が必要だった。,
137,ban,禁止する、禁止,The city banned smoking in the park.,市は公園での喫煙を禁止した。,【対義語】allow（許可する）
137,compound,化合物、複合の,Water is a chemical compound.,水は化合物だ。,
137,detect,見つける、探知する,The machine can detect smoke.,その機械は煙を感知できる。,
137,detection,発見、検出,Early detection is important.,早期発見が重要だ。,
137,excel,優れている,She excels in math.,彼女は数学に秀でている。,
137,excellence,優秀さ,The school is known for excellence.,その学校は優秀さで知られている。,
137,excellent,優れた,That was an excellent answer.,それは優れた答えだった。,【対義語】poor（劣った）
137,expose,さらす、暴露する,The report exposed the truth.,その報告書は真実を暴露した。,【対義語】conceal（隠す）
137,exposure,さらされること、暴露,Too much sun exposure is dangerous.,日光にさらされすぎるのは危険だ。,
137,hybrid,雑種、混成の,This car is a hybrid.,この車はハイブリッド車だ。,
137,permit,許可する、許可証,Smoking is not permitted here.,ここでは喫煙は許可されていない。,
137,prohibit,禁止する,Smoking is prohibited here.,ここでは喫煙は禁止されている。,【対義語】permit（許可する）
138,approximately,およそ,The trip takes approximately two hours.,その旅行にはおよそ2時間かかる。,
138,chemist,化学者、薬剤師,The chemist tested the liquid.,化学者はその液体を調べた。,
138,devote,捧げる、専念する,She devotes her time to study.,彼女は勉強に時間を捧げている。,
138,devotion,献身、愛情,His devotion to work is impressive.,彼の仕事への献身は印象的だ。,
138,gut,腸、直感,Fiber is good for the gut.,食物繊維は腸によい。,
138,nerve,神経、度胸,The injury damaged a nerve.,そのけがは神経を傷つけた。,
138,nervous,緊張した、不安な,I was nervous before the test.,試験前、私は緊張していた。,
138,neural,神経の,Neural signals travel quickly.,神経信号は素早く伝わる。,
138,neuron,神経細胞,Neurons send information in the brain.,神経細胞は脳内で情報を送る。,
138,neuroscientist,神経科学者,The neuroscientist studied the brain.,その神経科学者は脳を研究した。,
138,rough,粗い、荒い,The road was rough.,その道はでこぼこしていた。,【対義語】smooth（滑らかな）
138,roughly,おおよそ、乱暴に,"It costs roughly 1,000 yen.",それはおおよそ1000円かかる。,
138,sensitive,敏感な、繊細な,Her skin is sensitive.,彼女の肌は敏感だ。,
138,sensitivity,敏感さ、感受性,He has great sensitivity to sound.,彼は音にとても敏感だ。,
138,tense,緊張した、張り詰めた,The room was tense.,部屋は緊張していた。,
139,command,命令、指揮する,The officer gave a command.,将校が命令を出した。,
139,data,データ、資料,We analyzed the data.,私たちはデータを分析した。,
139,dictate,書き取らせる、命令する,The teacher dictated the sentence.,先生はその文を書き取らせた。,
139,input,入力、意見,Please enter your input here.,ここに入力してください。,【対義語】output（出力）
139,output,出力、生産高,The factory increased its output.,工場は生産高を増やした。,【対義語】input（入力）
139,procedure,手順、手続き,Follow the correct procedure.,正しい手順に従いなさい。,
139,proceed,進む、続行する,We proceeded with the plan.,私たちは計画を進めた。,
139,process,過程、処理する,Learning is a long process.,学習は長い過程だ。,
139,sensory,感覚の,The brain processes sensory information.,脳は感覚情報を処理する。,
139,texture,手触り、質感,The cloth has a soft texture.,その布は柔らかい手触りだ。,
140,allergic,アレルギーのある,I'm allergic to cats.,私は猫アレルギーだ。,
140,allergy,アレルギー,She has a food allergy.,彼女は食物アレルギーを持っている。,
140,antique,骨董品の、骨董品,This shop sells antiques.,この店は骨董品を売っている。,
140,archive,記録保管所、保存する,The documents were placed in an archive.,その文書は保管庫に保存された。,
140,beverage,飲み物,Water is the best beverage.,水は最良の飲み物だ。,
140,boot,ブーツ、長靴,She bought new boots.,彼女は新しいブーツを買った。,
140,brake,ブレーキ,The driver hit the brake.,運転手はブレーキを踏んだ。,
140,caffeine,カフェイン,Coffee contains caffeine.,コーヒーにはカフェインが含まれている。,
140,cholesterol,コレステロール,Too much cholesterol is unhealthy.,コレステロールの取りすぎは健康によくない。,
140,clip,クリップ、切り取る,Use a clip to hold the papers.,紙を留めるためにクリップを使いなさい。,
140,cocoa,ココア,I drank hot cocoa.,私は温かいココアを飲んだ。,
140,documentary,ドキュメンタリー,We watched a documentary about nature.,私たちは自然についてのドキュメンタリーを見た。,
140,engine,エンジン,The engine started smoothly.,エンジンはスムーズに始動した。,
140,fashionable,流行の、おしゃれな,She wore fashionable clothes.,彼女はおしゃれな服を着ていた。,
140,glossary,用語集,Check the glossary for the word.,その単語は用語集で確認しなさい。,
140,gum,歯ぐき、ガム,My gums hurt.,歯ぐきが痛い。,
140,handout,配布資料,The teacher gave us a handout.,先生は私たちに配布資料を渡した。,
140,jazz,ジャズ,I like listening to jazz.,私はジャズを聴くのが好きだ。,
140,melody,旋律、メロディー,The song has a beautiful melody.,その歌には美しいメロディーがある。,
140,motor,モーター、運動の,The motor stopped suddenly.,モーターが突然止まった。,
140,orchestra,オーケストラ,The orchestra played beautifully.,オーケストラは美しく演奏した。,
140,peanut,ピーナッツ、落花生,He is allergic to peanuts.,彼はピーナッツアレルギーだ。,
140,whistle,口笛を吹く、笛,He whistled a song.,彼は歌を口笛で吹いた。,
144,create,創造する、作る,Artists create new works.,芸術家は新しい作品を創造する。,
144,creation,創造、創作物,The creation of the system took years.,そのシステムの作成には何年もかかった。,
144,creative,創造的な,She has a creative mind.,彼女は創造的な考え方を持っている。,
144,creativity,創造力,Creativity is important in design.,デザインでは創造力が重要だ。,
144,creator,創作者、創造主,He is the creator of the game.,彼はそのゲームの制作者だ。,
144,force,力、強制する,The wind has great force.,風には大きな力がある。,
144,ideal,理想、理想的な,This is an ideal place to study.,ここは勉強するのに理想的な場所だ。,
144,ideally,理想的には,"Ideally, we should start early.",理想的には早く始めるべきだ。,
144,ingenious,独創的な、巧妙な,She found an ingenious solution.,彼女は独創的な解決策を見つけた。,
144,production,生産、製造,Production increased this year.,今年、生産が増えた。,
144,productive,生産的な,It was a productive meeting.,それは生産的な会議だった。,
144,productivity,生産性,Technology improves productivity.,技術は生産性を高める。,
144,reproduce,繁殖する、再生する,Some animals reproduce quickly.,一部の動物は速く繁殖する。,
144,reproduction,繁殖、再生,Reproduction is essential for life.,繁殖は生命に不可欠だ。,
144,reproductive,生殖の,Reproductive health is important.,生殖に関する健康は重要だ。,
144,rubbish,ごみ、くだらないもの,Put the rubbish in the bin.,ごみを箱に入れなさい。,
144,sewage,下水,Sewage treatment is necessary.,下水処理は必要だ。,
144,waste,無駄、ごみ、浪費する,Do not waste water.,水を無駄にしてはいけない。,
144,wasteful,無駄の多い、浪費する,It is wasteful to throw away food.,食べ物を捨てるのは無駄だ。,
145,chip,小片、チップ,This cup has a chip.,このカップには欠けた部分がある。,
145,fashion,流行、ファッション,Fashion changes quickly.,流行はすぐに変わる。,
145,impose,課す、押しつける,The government imposed a tax.,政府は税を課した。,
145,mobile,移動式の、携帯の,Mobile phones are useful.,携帯電話は便利だ。,
145,portion,部分、一人前,She ate a small portion.,彼女は少量を食べた。,
145,shift,変化、移す,There was a shift in opinion.,意見に変化があった。,
145,violence,暴力,Violence should never be accepted.,暴力は決して受け入れられるべきではない。,
145,violent,暴力的な、激しい,The storm was violent.,嵐は激しかった。,【対義語】peaceful（平和な）
145,wear,着る、すり減る,She wears a blue coat.,彼女は青いコートを着ている。,
146,alter,変える,We need to alter the plan.,私たちは計画を変更する必要がある。,
146,alternate,交互の,The players took alternate turns.,選手たちは交互に順番を取った。,
146,alternative,代替の,We need an alternative solution.,私たちは代替案が必要だ。,
146,appreciate,感謝する、正しく理解する,I appreciate your help.,ご支援に感謝します。,
146,appreciation,感謝,His appreciation was sincere.,彼の感謝は心からのものだった。,
146,fragment,破片、断片,I found a fragment of glass.,私はガラスの破片を見つけた。,
146,grasp,つかむ、理解する,She grasped the meaning.,彼女は意味を理解した。,
146,philosopher,哲学者,The philosopher wrote about justice.,その哲学者は正義について書いた。,
146,philosophical,哲学の、哲学的な,That is a philosophical question.,それは哲学的な問いだ。,
146,philosophy,哲学、考え方,She studies philosophy.,彼女は哲学を学んでいる。,
146,prefecture,県、府,Kyoto is a prefecture in Japan.,京都は日本の府である。,
147,appliance,器具、家電製品,This store sells kitchen appliances.,この店はキッチン家電を販売している。,
147,collect,集める,She collects stamps.,彼女は切手を集めている。,
